{
  "metadata": {
    "version": "v1",
    "source": "AI",
    "confidence": 0.84,
    "units": "metric",
    "project_id": "GBPV2-EX-001",
    "project_name": "Simple HK Office Floor Example",
    "created_at": "2026-04-18",
    "updated_at": "2026-04-18",
    "input_artifacts": [
      {
        "id": "SRC-001",
        "type": "vector_pdf",
        "path": "synthetic://schema-demo",
        "sheet_name": "schema-demo"
      }
    ],
    "notes": [
      "Synthetic example for neutral structural schema V1.",
      "Not a Figure Q recognition result.",
      "Prepared for schema validation and review DXF generation."
    ]
  },
  "source_of_truth": "json",
  "coordinate_system": {
    "type": "global_project",
    "origin": { "x": 0, "y": 0, "z": 0 },
    "rotation_degrees": 0,
    "length_unit": "mm",
    "elevation_unit": "mm",
    "grid_reference_basis": "Grid A / Grid 1 intersection at LG1 is the global origin."
  },
  "intent_model": {
    "grids": [
      { "id": "GR-X-A", "label": "A", "orientation": "x", "curve": [{ "x": 0, "y": 0 }, { "x": 0, "y": 16000 }], "spacing_to_next": 8000 },
      { "id": "GR-X-B", "label": "B", "orientation": "x", "curve": [{ "x": 8000, "y": 0 }, { "x": 8000, "y": 16000 }], "spacing_to_next": 8000 },
      { "id": "GR-X-C", "label": "C", "orientation": "x", "curve": [{ "x": 16000, "y": 0 }, { "x": 16000, "y": 16000 }] },
      { "id": "GR-Y-1", "label": "1", "orientation": "y", "curve": [{ "x": 0, "y": 0 }, { "x": 16000, "y": 0 }], "spacing_to_next": 8000 },
      { "id": "GR-Y-2", "label": "2", "orientation": "y", "curve": [{ "x": 0, "y": 8000 }, { "x": 16000, "y": 8000 }], "spacing_to_next": 8000 },
      { "id": "GR-Y-3", "label": "3", "orientation": "y", "curve": [{ "x": 0, "y": 16000 }, { "x": 16000, "y": 16000 }] }
    ],
    "levels": [
      { "id": "LV-LG1-000", "name": "LG1", "elevation": 0, "role": "ground" },
      { "id": "LV-L02-4000", "name": "L02", "elevation": 4000, "role": "typical" },
      { "id": "LV-RF-8000", "name": "RF", "elevation": 8000, "role": "roof" }
    ],
    "columns": [
      { "id": "CO-A1-001", "base_level_id": "LV-LG1-000", "top_level_id": "LV-RF-8000", "location": { "x": 0, "y": 0 }, "reference_axes": { "x_grid": "A", "y_grid": "1", "offset_x": 0, "offset_y": 0 }, "section_seed_id": "SC-COL-600X600", "rotation_degrees": 0, "structural_role": "combined" },
      { "id": "CO-A2-001", "base_level_id": "LV-LG1-000", "top_level_id": "LV-RF-8000", "location": { "x": 0, "y": 8000 }, "reference_axes": { "x_grid": "A", "y_grid": "2", "offset_x": 0, "offset_y": 0 }, "section_seed_id": "SC-COL-600X600", "rotation_degrees": 0, "structural_role": "combined" },
      { "id": "CO-A3-001", "base_level_id": "LV-LG1-000", "top_level_id": "LV-RF-8000", "location": { "x": 0, "y": 16000 }, "reference_axes": { "x_grid": "A", "y_grid": "3", "offset_x": 0, "offset_y": 0 }, "section_seed_id": "SC-COL-600X600", "rotation_degrees": 0, "structural_role": "combined" },
      { "id": "CO-B1-001", "base_level_id": "LV-LG1-000", "top_level_id": "LV-RF-8000", "location": { "x": 8000, "y": 0 }, "reference_axes": { "x_grid": "B", "y_grid": "1", "offset_x": 0, "offset_y": 0 }, "section_seed_id": "SC-COL-600X600", "rotation_degrees": 0, "structural_role": "combined" },
      { "id": "CO-B3-001", "base_level_id": "LV-LG1-000", "top_level_id": "LV-RF-8000", "location": { "x": 8000, "y": 16000 }, "reference_axes": { "x_grid": "B", "y_grid": "3", "offset_x": 0, "offset_y": 0 }, "section_seed_id": "SC-COL-600X600", "rotation_degrees": 0, "structural_role": "combined" },
      { "id": "CO-C1-001", "base_level_id": "LV-LG1-000", "top_level_id": "LV-RF-8000", "location": { "x": 16000, "y": 0 }, "reference_axes": { "x_grid": "C", "y_grid": "1", "offset_x": 0, "offset_y": 0 }, "section_seed_id": "SC-COL-600X600", "rotation_degrees": 0, "structural_role": "combined" },
      { "id": "CO-C2-001", "base_level_id": "LV-LG1-000", "top_level_id": "LV-RF-8000", "location": { "x": 16000, "y": 8000 }, "reference_axes": { "x_grid": "C", "y_grid": "2", "offset_x": 0, "offset_y": 0 }, "section_seed_id": "SC-COL-600X600", "rotation_degrees": 0, "structural_role": "combined" },
      { "id": "CO-C3-001", "base_level_id": "LV-LG1-000", "top_level_id": "LV-RF-8000", "location": { "x": 16000, "y": 16000 }, "reference_axes": { "x_grid": "C", "y_grid": "3", "offset_x": 0, "offset_y": 0 }, "section_seed_id": "SC-COL-600X600", "rotation_degrees": 0, "structural_role": "combined" }
    ],
    "beams": [
      { "id": "BM-A1-B1-001", "level_id": "LV-L02-4000", "start": { "x": 0, "y": 0 }, "end": { "x": 8000, "y": 0 }, "reference_axes": { "x_grid": "A-B", "y_grid": "1", "offset_x": 0, "offset_y": 0 }, "section_seed_id": "SC-BM-300X600", "beam_role": "primary" },
      { "id": "BM-B1-C1-001", "level_id": "LV-L02-4000", "start": { "x": 8000, "y": 0 }, "end": { "x": 16000, "y": 0 }, "reference_axes": { "x_grid": "B-C", "y_grid": "1", "offset_x": 0, "offset_y": 0 }, "section_seed_id": "SC-BM-300X600", "beam_role": "primary" },
      { "id": "BM-A3-B3-001", "level_id": "LV-L02-4000", "start": { "x": 0, "y": 16000 }, "end": { "x": 8000, "y": 16000 }, "reference_axes": { "x_grid": "A-B", "y_grid": "3", "offset_x": 0, "offset_y": 0 }, "section_seed_id": "SC-BM-300X600", "beam_role": "primary" },
      { "id": "BM-B3-C3-001", "level_id": "LV-L02-4000", "start": { "x": 8000, "y": 16000 }, "end": { "x": 16000, "y": 16000 }, "reference_axes": { "x_grid": "B-C", "y_grid": "3", "offset_x": 0, "offset_y": 0 }, "section_seed_id": "SC-BM-300X600", "beam_role": "primary" },
      { "id": "BM-A1-A2-001", "level_id": "LV-L02-4000", "start": { "x": 0, "y": 0 }, "end": { "x": 0, "y": 8000 }, "reference_axes": { "x_grid": "A", "y_grid": "1-2", "offset_x": 0, "offset_y": 0 }, "section_seed_id": "SC-BM-300X600", "beam_role": "primary" },
      { "id": "BM-A2-A3-001", "level_id": "LV-L02-4000", "start": { "x": 0, "y": 8000 }, "end": { "x": 0, "y": 16000 }, "reference_axes": { "x_grid": "A", "y_grid": "2-3", "offset_x": 0, "offset_y": 0 }, "section_seed_id": "SC-BM-300X600", "beam_role": "primary" },
      { "id": "BM-C1-C2-001", "level_id": "LV-L02-4000", "start": { "x": 16000, "y": 0 }, "end": { "x": 16000, "y": 8000 }, "reference_axes": { "x_grid": "C", "y_grid": "1-2", "offset_x": 0, "offset_y": 0 }, "section_seed_id": "SC-BM-300X600", "beam_role": "primary" },
      { "id": "BM-C2-C3-001", "level_id": "LV-L02-4000", "start": { "x": 16000, "y": 8000 }, "end": { "x": 16000, "y": 16000 }, "reference_axes": { "x_grid": "C", "y_grid": "2-3", "offset_x": 0, "offset_y": 0 }, "section_seed_id": "SC-BM-300X600", "beam_role": "primary" },
      { "id": "BM-CORE-S-001", "level_id": "LV-L02-4000", "start": { "x": 6000, "y": 6000 }, "end": { "x": 10000, "y": 6000 }, "reference_axes": { "x_grid": "B", "y_grid": "2", "offset_x": 0, "offset_y": -2000 }, "section_seed_id": "SC-BM-250X500", "beam_role": "secondary" },
      { "id": "BM-CORE-E-001", "level_id": "LV-L02-4000", "start": { "x": 10000, "y": 6000 }, "end": { "x": 10000, "y": 10000 }, "reference_axes": { "x_grid": "B", "y_grid": "2", "offset_x": 2000, "offset_y": 0 }, "section_seed_id": "SC-BM-250X500", "beam_role": "secondary" },
      { "id": "BM-CORE-N-001", "level_id": "LV-L02-4000", "start": { "x": 10000, "y": 10000 }, "end": { "x": 6000, "y": 10000 }, "reference_axes": { "x_grid": "B", "y_grid": "2", "offset_x": 0, "offset_y": 2000 }, "section_seed_id": "SC-BM-250X500", "beam_role": "secondary" },
      { "id": "BM-CORE-W-001", "level_id": "LV-L02-4000", "start": { "x": 6000, "y": 10000 }, "end": { "x": 6000, "y": 6000 }, "reference_axes": { "x_grid": "B", "y_grid": "2", "offset_x": -2000, "offset_y": 0 }, "section_seed_id": "SC-BM-250X500", "beam_role": "secondary" }
    ],
    "walls": [
      { "id": "WA-CORE-S-001", "base_level_id": "LV-LG1-000", "top_level_id": "LV-RF-8000", "centerline": [{ "x": 6000, "y": 6000 }, { "x": 10000, "y": 6000 }], "thickness": 250, "wall_role": "core" },
      { "id": "WA-CORE-E-001", "base_level_id": "LV-LG1-000", "top_level_id": "LV-RF-8000", "centerline": [{ "x": 10000, "y": 6000 }, { "x": 10000, "y": 10000 }], "thickness": 250, "wall_role": "core" },
      { "id": "WA-CORE-N-001", "base_level_id": "LV-LG1-000", "top_level_id": "LV-RF-8000", "centerline": [{ "x": 10000, "y": 10000 }, { "x": 6000, "y": 10000 }], "thickness": 250, "wall_role": "core" },
      { "id": "WA-CORE-W-001", "base_level_id": "LV-LG1-000", "top_level_id": "LV-RF-8000", "centerline": [{ "x": 6000, "y": 10000 }, { "x": 6000, "y": 6000 }], "thickness": 250, "wall_role": "core" }
    ],
    "slabs": [
      { "id": "SL-L02-001", "level_id": "LV-L02-4000", "boundary": [{ "x": 0, "y": 0 }, { "x": 16000, "y": 0 }, { "x": 16000, "y": 16000 }, { "x": 0, "y": 16000 }, { "x": 0, "y": 0 }], "thickness_seed": 150, "section_seed_id": "SC-SL-150" }
    ],
    "openings": [
      { "id": "OP-CORE-001", "level_id": "LV-L02-4000", "boundary": [{ "x": 6000, "y": 6000 }, { "x": 10000, "y": 6000 }, { "x": 10000, "y": 10000 }, { "x": 6000, "y": 10000 }, { "x": 6000, "y": 6000 }], "opening_type": "shaft" }
    ],
    "uncertainty": [
      { "id": "UC-001", "entity_id": "BM-CORE-S-001", "field": "beam_role", "confidence": 0.62, "reason": "Primary versus secondary classification is inferred from span hierarchy rather than explicit source tags.", "evidence_path": "manual_assumption", "fallback_assumption": "Keep as secondary review beam unless office criteria require collector behavior." },
      { "id": "UC-002", "entity_id": "SL-L02-001", "field": "thickness_seed", "confidence": 0.55, "reason": "150 mm slab thickness is a seed assumption for analysis readiness, not a final design output.", "evidence_path": "manual_assumption", "fallback_assumption": "Review against span-depth and vibration criteria before solver export." },